제목,작성자,작성시간,추천수,댓글수,내용,URL,플레어,업로드_비율
"Weekly Discussion Thread - January 21, 2025",AutoModerator,2025-01-21 20:01:50,3,2,"This is a dedicated space for open conversation on all things algorithmic and systematic trading. Whether you’re a seasoned quant or just getting started, feel free to join in and contribute to the discussion. Here are a few ideas for what to share or ask about:

* **Market Trends:** What’s moving in the markets today?
* **Trading Ideas and Strategies:** Share insights or discuss approaches you’re exploring. What have you found success with? What mistakes have you made that others may be able to avoid?
* **Questions & Advice:** Looking for feedback on a concept, library, or application?
* **Tools and Platforms:** Discuss tools, data sources, platforms, or other resources you find useful (or not!).
* **Resources for Beginners:** New to the community? Don’t hesitate to ask questions and learn from others.

Please remember to keep the conversation respectful and supportive. Our community is here to help each other grow, and thoughtful, constructive contributions are always welcome.",https://reddit.com/r/algotrading/comments/1i6g58b/weekly_discussion_thread_january_21_2025/,,1.0
insight on Pumpportal vs bitquery for Pump.fun api,Normal-Astronomer-83,2025-01-26 05:06:57,4,0,"Hi all, what a thought a complete beginner wishes to make an AI trading bot for meme coins; I know, I know. 

Well, bare with me. 

  
As I embark on this project, I'm curious if anyone with experience has anything to say about either of these third-party API providers. 

  
Thanks!",https://reddit.com/r/algotrading/comments/1i9vpfa/insight_on_pumpportal_vs_bitquery_for_pumpfun_api/,Data,0.83
Anyone interested in deeper networking?,_melfice_,2025-01-25 07:54:30,66,56,"Hey all,

Been here a while and interested in networking more with people either in my position, doing better, or me from a few years ago when I was just starting to get established.

Would be great to have some folks to chat with more on a daily or weekly basis, like a group of ppl in a similar situation. I've had some cool exchanges with people on this sub over the years and really miss that aspect of chatting with others full time like I used to at work. 

* **Moved** *

**Shoot me a dm if you're in one of these groups and want to try and get something started. If not I'll f\*\*\* off and never make a post like this again.**

I've tried this with daytraders or prop/bucket shop traders but it ends up being a lot of noise. The conversations become really annoying/toxic because so much of what they are fluctuate day to day based on their own pnl. They also don't seem to last very long which is its' own kind of depressing.

I don't care about your alpha, there can even be a hard rule to never discuss explicit alpha. There are so many other factors that go into doing this for a living, things like: commiserating rough days/dds, hyping up big days or big updates/milestones to business/process, technical talk(non alpha/IP related), how this stuff affects your life and maybe just some general venting, general market talk and speculation, and potentially do some irl meetups.

**My background:**

I worked in FAANG for a decade and left my career to build trading bots full time. That was 2 years ago and after clumsily learning how to scale and make this a business I now have roughly 1.5m aum. It's been a long road to stabilize things and there are tons more to discuss but I don't want to write a giant diatribe. I am currently working through and just starting to execute my 5 year plan to keep growing and survive the markets long term. 

  
**People I'm interested in chatting with**

**In my position:**

\- Doing this full time for 1-2 years

\- Technical background

\- Still in the process of scaling their business

\- Have a long term plan they're just starting to execute

**Doing better than me:**

\- full time longer than 2 years

\- more established in their business

\- Already have a long term plan that they are currently executing

**Me from 2 years ago:**

\- Built something that's starting to do well

\- In the process of leaving their job/career to pursue this full time

\- Just thinking about their long term plans/goals

  ",https://reddit.com/r/algotrading/comments/1i98hh3/anyone_interested_in_deeper_networking/,Career,0.92
What is the Monte Carlo method used for in backtesting?,aitorp6,2025-01-25 02:22:16,48,27,"Hi!

I asked as a response to a comment in another post, in this same sub-reddit, bay I had not repsonse. 

The thing is that I know what a Mote Carlo method is, but i can't imagen how can be used in backtesting. What is the variable subjet to the randoness? Is it used with a gaussian distribution or another one?



 Can any of you give me a simple example? 


Edit 1: couple of typo fixed

Edit 2: thank you all for your answers. There have been some good ideas and some interesting discussions. thank you all for your answers. I need to process these ideas and fully understand them.",https://reddit.com/r/algotrading/comments/1i90odm/what_is_the_monte_carlo_method_used_for_in/,Education,0.93
Regime focus in Backtesting - How important is it?,JonnyTwoHands79,2025-01-25 04:41:21,9,10,"Hey everyone,

I'm curious what your thoughts are on how much weight you put on testing during different historical market regimes, particularly in regards to determining if a strategy has been overfit to the most recent regime.

My strategy is pretty profitable in the last year (200%+ profitable, profit factor > 2), but it doesn't have a very high Sharpe Ratio (1 range at best), and it definitely breaks down when I start spanning multiple regimes. I also haven't performed Monte Carlo simulations either.

I'm curious:

1. How much consideration should put on Sharpe Ratio, regime testing, Monte Carlo, and walk-forward testing?

I've currently back tested for a 2 year timeframe (last regime) and forward tested for a year with decent profitability, but I'm nervous about the robustness of my strategy when I start looking into these other regimes as performance deteriorates (or goes negative).

Any thoughts or learnings are appreciated!

https://preview.redd.it/okzg2ic8wzee1.png?width=882&format=png&auto=webp&s=2da083c56c7dffbc5d3d15351845df23fa37e973

**Edit**: Thanks for the responses thus far, much appreciated. Adding a little more background for context:  
\- My strategy is a trend-following / momentum based strategy  
\- I've back tested it during each of the regimes above (with separate parameters for each regime) and can find profitability within each regime (and sometimes spanning multiple regimes), but I can't find consistent profitability over the entire 10 year span above using the same parameters.

\- **My thesis (flawed or not) is:** Optimize and continue to improve a single strategy that can be adjusted to any regime (or almost any) and generate very high returns, with the assumption I'll still have to monitor regimes and adjust settings every 6 months or so to maintain profitability. I'm aiming for high returns with the trade off of needing to adjust it intermittently.

\- **One of my biggest questions**: Do successful algo traders have strategies that are truly robust and ""regime agnostic"" that they rarely adjust (set and forget), or do they monitor for regime changes and adjust their settings accordingly?",https://reddit.com/r/algotrading/comments/1i940z3/regime_focus_in_backtesting_how_important_is_it/,Strategy,1.0
How impactful is ITCH data to your trading,DopeyDonkeyUser,2025-01-25 09:04:37,2,0,"For those whom launched with full book data NOM and Equities, hoe much of an impact has it improved your performance?

What type of data have you seen has the strongest predictive power?",https://reddit.com/r/algotrading/comments/1i9a0d7/how_impactful_is_itch_data_to_your_trading/,Data,0.58
I want to learn how to trade as someone capable of working with numbers/coding. Where do I start?,okaythanksbud,2025-01-24 16:27:38,12,22,"I have nearly 0 knowledge of trading or how most businesses operate. I’m still very young so I have a lot of time to learn but want to do so asap. I’ve only ever had interest in learning subjects with rigor, the thought of being in a business school class and looking at whatever color-print books accessible to 99% of the population they use nauseate me. I don’t know why, but unless the book is written in B&W with a super dry, definition-explanation-example type of format I have no interest in reading it.

I am wondering if there any any introductory books/textbooks to trading/finance/whatever that come from a somewhat rigorous standpoint, and will allow me to 1: learn the basics, 2: learn whatever theory underlies it, 3: actually apply the concepts to see actual returns. I would be surprised if any single book on this existed, so I would be very happy with any amount of books that sum up to this content.

I appreciate any advice!",https://reddit.com/r/algotrading/comments/1i8q34d/i_want_to_learn_how_to_trade_as_someone_capable/,Education,0.68
Alpaca's Trump Hypothesis,Jrbell19,2025-01-24 02:12:08,90,9,"Hello folks of r/algotrading \- 

I wanted to highlight an article that showcases the kind of informative, process-driven content that aligns perfectly with the spirit of this community.

For newbies - We see TONS of posts filtered out due to low-quality posts or general ‘how do I start’ questions. This post outlines the essential starting point: developing a hypothesis, building a testing framework, and continuously iterating until you’re confident enough to deploy with capital. 

While I don’t expect everyone to share their strategies or match this level of detail, I hope this inspires more process-oriented content that will encourage discussion. 

Feel free to share any similar content you’ve come across that may be insightful or helpful for the new members! 

Alpaca's Article:

# [The Stock Market Under Trump: A Hypothesis Based on Former Republican Presidencies](https://alpaca.markets/learn/the-stock-market-under-trump-a-hypothesis-based-on-former-republican-presidencies)",https://reddit.com/r/algotrading/comments/1i88cqj/alpacas_trump_hypothesis/,Strategy,0.94
Intraday SL,Jeckry,2025-01-24 10:23:57,11,9,"Need some advice for the backtesting of my trading bot.

I made a bot with pine script on Tradingview and Im currently running it on bybit, the live trading works exactly as I planned but i encounter some problems with tradingview backtesting.

The problem is that the backtesting ignores intracandle sl, it only gets data at candle closure and that doesnt really work for my case, I have tried everything to find a way around it so Im thinking to migrate to an other platform for my backtesting.

Do you guys have found a solution to this issue or if not what platform should I migrate to.",https://reddit.com/r/algotrading/comments/1i8jrsy/intraday_sl/,Education,1.0
What platform/framework for crypto and stock trading?,FatefulDonkey,2025-01-24 04:30:09,7,10,"I wonder what everyone is using for automated trading and what is the pros/cons people find.

Namely we're building a new tool that will support both crypto and stock exchanges and we're interested to know what people actually find lacking out there.",https://reddit.com/r/algotrading/comments/1i8bqj9/what_platformframework_for_crypto_and_stock/,Infrastructure,0.82
Any exchanges that allow bots for paper trading?,hoosierpride1,2025-01-24 12:05:22,0,23,"Hello fellow apes,

Are there an  exchanges that let you deploy different types of trading bots (grid, dca, reverse grid,smart rebalance) to first test strategies in a paper trading account?

I am primarily looking for trading stocks and crypto.

Thanks in advance!!",https://reddit.com/r/algotrading/comments/1i8ls79/any_exchanges_that_allow_bots_for_paper_trading/,Other/Meta,0.5
"In the US, what crypto exchange to use?",Desalzes_,2025-01-24 00:20:20,7,20,"I've written a good bot that does great doing live paper trading but...

Every exchange I've seen that I have access to is in the realm of .4% exchange fees, [binance.us](http://binance.us) is banned in my state. I don't know about using a vpn because I saw you can get your account locked, was wondering if anyone here knows what I should be using",https://reddit.com/r/algotrading/comments/1i85pgo/in_the_us_what_crypto_exchange_to_use/,Data,0.78
I'm giving up,na85,2025-01-24 05:29:15,4,58,"... on Common Lisp.

The library ecosystem is just so devoid of anything useful for finance-related use cases I'm just fucking tired of swimming upstream.  I have two strategies running, both written in lisp.  One is more-or-less feature complete and I'm going to just leave it in maintenance mode until profits dry up.

I'm going to port the second one, which is a trend-following strategy that's still in the development/refining stage to something a little less hipster.  Not python because semantic indentation is for fucking insane people. 

But probably C# or Go.  Mayyyybe C++ but I don't know if I have the energy for that.  I know the language reasonably well but, y'know, garbage collection is so convenient.

I am open to suggestions.",https://reddit.com/r/algotrading/comments/1i8d51e/im_giving_up/,Infrastructure,0.56
"Wondering if anyone knows of a library, don't really care which language, that will let me input a list of trades and then deliver performance metrics.",sourbrew,2025-01-23 22:20:27,7,15,"Basically what it says on the tin, ideally I'd be able to compare to a buy and hold strategy on the same instrument, although I could simply generate that as a separate list of trades.

Should at least include annual performance, but would also like monthly.

Bonus points would be the ability to implement a weighted portfolio, like 50% SPY 50% TLT.

Additional points for rebalancing if one strat was flat and the other was long, and to be able to set a separate strategy for hedges, ie: if I was trading SPY, and it was flat, but an SH strategy was long it would load up on SH, but then rebalance into SPY if there was a SPY long signal.",https://reddit.com/r/algotrading/comments/1i836k1/wondering_if_anyone_knows_of_a_library_dont/,Infrastructure,0.82
Anyone recommend against using PineScript + TradingView Alerts?,AncientKyogre,2025-01-23 22:14:31,5,8,"New to algotrading.  I have a webhook that connects my trading view alerts to MT4. It's functional  although I'm concerned that too many alerts may clog the system and cause latency issues.

What else can I do except converting my pine script into an MT4 EA?",https://reddit.com/r/algotrading/comments/1i832dc/anyone_recommend_against_using_pinescript/,Education,1.0
Books you'd recommend to someone getting started in algorithmic trading?,gotchab003,2025-01-23 05:15:05,56,60,"I currently work as a software developer and I'm interested in learning the basics about algorithmic trading, assuming I know pretty much nothing about it. I found a book named ""Algorithmic Trading and DMA: An introduction to direct access trading strategies"" by Barry Johnson, but it has mixed reviews, some people loved it, others found it worthless. Do you have any recommendation of books you found useful?

Thanks a lot in advance!",https://reddit.com/r/algotrading/comments/1i7kqq4/books_youd_recommend_to_someone_getting_started/,Education,0.91
Does ‘Sharing is Caring’ Apply to the Trading Industry?,dadiamma,2025-01-22 14:55:19,63,66,"I have a lot of profitable strategies (non-algo, but I’ve recently gotten into algo trading) that have made me more than enough. I wanted to help others by sharing some strategies that beginners can try. However, I’ve noticed many times on here and in other forums that people are hesitant to share their “secret sauce.”

So, I wanted to understand why sharing might be a bad idea. Should I keep these strategies to myself? Would sharing them hurt the industry if these methods become widely known? After all, aren’t we just small fish in a big sea, so why would our individual edge matter?

Sorry if this comes across as a silly question, but I’m genuinely wondering how I can give back to the community. In my primary field (digital marketing), which is where I’ve built my main wealth, I’ve often seen people openly share their “secret sauce” techniques.

Note: Please don’t PM me asking for the strategies. I’m not interested in selling anything—just trying to earn some real-life karma points (not Reddit karma).",https://reddit.com/r/algotrading/comments/1i74fzw/does_sharing_is_caring_apply_to_the_trading/,Other/Meta,0.81
Questions for those who created their own backtesting engines,Matusaprod,2025-01-22 10:16:37,63,57,"- Was it worth it? Would you do it again?
- Are you profitable/full time algo trading?
- If yes, would you focus on reaching consistent results before bothering with building a backtesting engine or vice-versa?
- If not, besides gaining experience, would you still do it or not? If you're not consistent/profitable/trading for a living, why even bother to create your own engine?",https://reddit.com/r/algotrading/comments/1i6z0p0/questions_for_those_who_created_their_own/,Infrastructure,0.94
"The simplest (dumbest) idea, but why wont just work?",Zenithine,2025-01-22 16:26:32,16,35,"I've been fixated on Renko bars lately because of their purity at showing price action irrespective of everything else. I had this idea for a NinjaScript strategy that - in theory - should work, but when I test in a sim account with different sized bars and slightly altered variables it just never churns out any profit at all.

    if(
      Position.MarketPosition == MarketPosition.Flat && // No positions currently open
      Close[1] > Open[1] && // Previous bar was green
      Close[0] > ema200[0] // we're above the EMA
      )
    {
      EnterLong(1); // Open long position
    }
    
    if(
      Position.MarketPosition == MarketPosition.Long && // Currently long
      Close[1] < Open[1] // Previous bar closed red
      )
    {
      ExitLong(); // Close position
    }

I get that this braindead in its appearance, but when you look at a renko chart, the price spends more time moving distances than it does chopping up and down

[image source: investopedia.com](https://preview.redd.it/udtclxxnyhee1.png?width=1500&format=png&auto=webp&s=8ab56b123e7a5621bfed254b3a81dcb10bbcbb77)

In a back test against 1 month of data this strategy claimed 10's of thousands of dollars in profits across 20,000 total trades (profits include commissions).

But in a live Sim test it was a big net loss. I'm struggling to understand why it wont work. maybe im dumb",https://reddit.com/r/algotrading/comments/1i75s1b/the_simplest_dumbest_idea_but_why_wont_just_work/,Strategy,0.81
How to test strategies and back test them,Sweet-Dress4742,2025-01-23 00:56:11,1,19,"Hi,I am new to day trading and i see everybody talking about testing strategies and backtesting them,saying i have 65% success rate something or other.Like how do i do it and what is meaning of strategies here like you can’t predict the market right,a bot can’t do that right then how do they do it and what is the actual meaning behind it.please explain in detail about it and how to do it.",https://reddit.com/r/algotrading/comments/1i7eb17/how_to_test_strategies_and_back_test_them/,Education,0.52
Library do you guys use for Backtesting,glaksmono,2025-01-21 19:38:43,42,49,"I'm considering to use [https://github.com/Grademark/grademark](https://github.com/Grademark/grademark)

Is that pretty good? Any other suggestions?",https://reddit.com/r/algotrading/comments/1i6ftim/library_do_you_guys_use_for_backtesting/,Infrastructure,0.88
Looking for one mediocre strategy idea to backtest on Futures data,SeagullMan2,2025-01-22 02:50:38,9,29,"Just looking for square one here. I have been actively backtesting and algotrading stocks for over 5 years. I would like to expand into the futures market. 

As I am a total noob in this domain, I am wondering if someone could offer one idea for me to start backtesting. It doesn't have to be good. Just something that makes sense in the context of how Futures are traded. 

For those with experience in both stocks and futures, what are the greatest differences that you have found in market behavior / dynamics?",https://reddit.com/r/algotrading/comments/1i6ohxq/looking_for_one_mediocre_strategy_idea_to/,Strategy,0.85
Where can I get free intraday trading data for the past year or more?,DolantheMFWizard,2025-01-21 06:04:11,17,22,"I'm starting with trading. Right now I'm learning the ropes, trying some basic algorithms. I've been using yFinance, but they only let you get 1 month's worth of intraday trading data. I'd like to see how certain algorithms perform and hyperparameters tune them. Where can I get more intraday data for free so I can see how these algorithms perform in more situations?",https://reddit.com/r/algotrading/comments/1i6119h/where_can_i_get_free_intraday_trading_data_for/,Data,0.84
How to Determine the Right Stop-Loss Percentage for Grid Bots?,dadiamma,2025-01-21 00:37:47,15,26,"
I’m transitioning from manual trading to algorithmic trading, so I’m still a beginner in this space. While I’ve been able to create profitable grid bots, I’m struggling with one key aspect: determining the appropriate stop-loss amount or percentage.

In manual trading, I used a strict 1% stop-loss rule, but applying this same approach in a [grid bot](https://www.binance.com/en/square/post/1282566825826) (if someone doesn’t know about grid bots here is the link) strategy has been problematic, especially since the bot executes around 500 trades per day. 

When I use the 1% rule, positions often get stopped out too quickly. I suspect this is due to the unique dynamics of grid trading or the higher invested amounts the bot operates with.

I’m not looking for advice on how to apply a stop-loss but rather how to calculate or decide on the most effective stop-loss percentage for a high-frequency grid bot. 

What factors should I consider? 

Are there frameworks or techniques that can help arrive at a stop-loss amount that balances risk and performance?

Any guidance or insights would be greatly appreciated.

TL;DR:

Transitioning from manual trading to algo trading and struggling to determine the right stop-loss % for my grid bot (not how to apply it). My manual 1% stop-loss rule causes frequent stop-outs due to grid bot dynamics (500+ trades/day, higher investment). How do I calculate a suitable stop-loss % for high-frequency grid trading?",https://reddit.com/r/algotrading/comments/1i5swwp/how_to_determine_the_right_stoploss_percentage/,Other/Meta,0.81
Making a fast TA lib for public use,RubenTrades,2025-01-20 11:52:18,23,37,"I'm writing a technical analysis library with emphasis on speedy calculations. Maybe it could help folks out?

I ran some benchmarks on dummy data:

➡️ EMA over 30,000 candles in 0.18 seconds 
➡️ RSI over 30,000 candles done in 0.09 seconds
➡️ SMA over 30,000 candles in 0.14 seconds
➡️ RSI Bulk 100,000 candles in 0.40 seconds

Not sure how fast other libraries are, or what it should be to be fast? (Currently it's single-threaded but I could add multi-treads and SIMD operations, just not sure what wasm supporst yet).

All indicators are iterative, so if you get new live prices or new candles, it doesn't need to do the entire calculation again. 

It's built in Rust and compiles to web assembly, so any web-based algos (python, json, js, ts) can calculate without blocking, and without garbage-collection slowdowns.

Is there a need/want for this? Or should it stay a hobby project? What other indicators / pattern detection should I add?

",https://reddit.com/r/algotrading/comments/1i5gdje/making_a_fast_ta_lib_for_public_use/,Infrastructure,0.82
"Long time lurker, first time strategy",The_Nifty_Skwab,2025-01-20 05:19:55,71,50,"Hey r/algotrading, I've been a lurker for a while now but never tried anything myself. This weekend I had some free time so I decided to code one of the ideas I had. The algorithm itself isn't anything fancier than a logistic regression on custom TA indicators.

Trained on a selection of S&P 500 stocks from 2020-2022 and tested on 2022-2025. With the test set I found:  
\- annual returns = 110.7%  
\- total wins/buys = 918/1336 (68.7%)  
\- max drawdown = 15.8%  
\- sharpe = 3.55

I'm not a finance person so most of my knowledge comes from posts on this sub. I need to do some more backtesting but I'm going to start small with some paper-trading tomorrow and see how it goes!

https://preview.redd.it/gh5l1ia1c0ee1.png?width=589&format=png&auto=webp&s=d8763d639a5b5d546e66fa53e80d5a9f155d6e05

EDIT: I used a lot of the suggestions in the comments to fix errors related to fees, slippage, and bunch of other tiny issues. I'm now seeing a sharpe of 2.8, annualized returns around 80%, but I can't get my draw-down below 20%. Still have lots of work to do but it's promising so far!

Edit2: nope",https://reddit.com/r/algotrading/comments/1i57xqi/long_time_lurker_first_time_strategy/,Strategy,0.97
